{
  "$schema": "../../config/site.config.schema.json",
  "site": {
    "title": "claw-dj — Links",
    "description": "90s hip-hop & R&B DJ mixes — sample lineages, full sets, and short transition clips. Built with software + AI (open source).",
    "url": "https://claw-dj-links.vercel.app",
    "language": "en",
    "favicon": "/favicon.svg"
  },
  "profile": {
    "handle": "claw-dj",
    "display_name": "claw-dj",
    "tagline": "All Night Long sample mixes · 90s hip-hop & R&B · Shorts + full sets",
    "avatar": "/avatar.jpg",
    "show_avatar": true,
    "show_handle": true,
    "show_tagline": true
  },
  "theme": {
    "preset": "dark-space",
    "color_scheme": "dark"
  },
  "footer": {
    "show": true,
    "credit": "© claw-dj",
    "show_powered_by": true
  },
  "social_meta": {
    "og_image": "https://claw-dj-links.vercel.app/og.png",
    "twitter_card": "summary_large_image"
  },
  "analytics": {
    "provider": "none"
  }
}
