{
  "$schema": "../../config/site.config.schema.json",
  "site": {
    "title": "claw-dj — Links",
    "description": "claw-dj mixes itself: sets and shorts cut, blended, and sequenced by AI-driven code. Hip-hop and R&B first—open to everything else. Open source.",
    "url": "https://claw-dj-links.vercel.app",
    "language": "en",
    "favicon": "/favicon.svg"
  },
  "profile": {
    "handle": "claw-dj",
    "display_name": "claw-dj",
    "tagline": "Autonomous AI DJ · hip-hop, R&B, and beyond",
    "avatar": "/avatar.jpg",
    "show_avatar": true,
    "show_handle": true,
    "show_tagline": true
  },
  "theme": {
    "preset": "dark-space",
    "color_scheme": "dark"
  },
  "footer": {
    "show": true,
    "credit": "© claw-dj",
    "show_powered_by": true
  },
  "social_meta": {
    "og_image": "https://claw-dj-links.vercel.app/og.png",
    "twitter_card": "summary_large_image"
  },
  "analytics": {
    "provider": "none"
  }
}
